{
  "role_id": "evcs",
  "label": "Wallbox / E-Auto (EVCS)",
  "baustein_notes": "Greenfield prefix Earnie_EAuto_*. Multi-EV: Prefix+Slug Titles; VI Check / VO paths use ev.{ev_id}.…. Live EV on house-profile ev consumer ehal_bindings. Pattern B VI mirrors Soll_A / Modus; VO pushes sens_*/get_*.",
  "recommended_markers": [
    {
      "ehal_field": "sens_evcs_active_power",
      "loxone_blocks_key": "ehal_bindings.sens_evcs_active_power",
      "suggested_name": "Earnie_EAuto_Leistung",
      "notes": "Active charge power (kW). Prefer EFM Load. Path ev.{ev_id}.sens_evcs_active_power."
    },
    {
      "ehal_field": "sens_evcs_connected",
      "loxone_blocks_key": "ehal_bindings.sens_evcs_connected",
      "suggested_name": "Earnie_EAuto_Angeschlossen",
      "notes": "1 = plugged in."
    },
    {
      "ehal_field": "sens_evcs_soc_act",
      "loxone_blocks_key": "ehal_bindings.sens_evcs_soc_act",
      "suggested_name": "Earnie_EAuto_SOC",
      "notes": "Vehicle SOC %."
    },
    {
      "ehal_field": "sens_evcs_bat_capacity",
      "loxone_blocks_key": "ehal_bindings.sens_evcs_bat_capacity",
      "suggested_name": "Earnie_EAuto_Kapazitaet",
      "notes": "Battery capacity kWh."
    },
    {
      "ehal_field": "get_evcs_nominal_current",
      "loxone_blocks_key": "ehal_bindings.get_evcs_nominal_current",
      "suggested_name": "Earnie_EAuto_MaxStrom",
      "notes": "Max/nominal current A."
    },
    {
      "ehal_field": "get_evcs_limit_soc",
      "loxone_blocks_key": "ehal_bindings.get_evcs_limit_soc",
      "suggested_name": "Earnie_EAuto_LimitSOC",
      "notes": "Charge limit SOC %."
    },
    {
      "ehal_field": "get_evcs_ready_by_time",
      "loxone_blocks_key": "ehal_bindings.get_evcs_ready_by_time",
      "suggested_name": "Ladewecker",
      "notes": "LoxAPP3 AlarmClock Bezeichnung; import merges onto EV with Zähler/power. Earnie reads ready-by via VO push (qualified get_evcs_ready_by_time)."
    },
    {
      "ehal_field": "set_evcs_max_current",
      "loxone_blocks_key": "ehal_bindings.set_evcs_max_current",
      "suggested_name": "Earnie_EAuto_Soll_A",
      "notes": "Charge current setpoint A."
    },
    {
      "ehal_field": "set_evcs_mode",
      "loxone_blocks_key": "ehal_bindings.set_evcs_mode",
      "suggested_name": "Earnie_EAuto_Modus",
      "notes": "Enum off | pv | now (Loxone Merker: 0 / 1 / 2)."
    }
  ],
  "reference": "docs/referenz/loxone-signals.md"
}
