{
  "role_id": "consumer",
  "label": "Flex-Verbraucher (Stub)",
  "baustein_notes": "Greenfield prefix Earnie_Verbraucher_*. Multi: Prefix+Slug Titles. Storage and Live/VO use consumer.{hk_id}.* (role stubs flex.* expand on import). Prefer EFM Load for power when the meter is that consumer.",
  "recommended_markers": [
    {
      "ehal_field": "flex.sens_power_act",
      "loxone_blocks_key": "ehal_bindings.consumer.{id}.sens_power_act",
      "suggested_name": "Earnie_Verbraucher_{Slug}_Leistung",
      "notes": "Read power. Storage/Live: consumer.{id}.sens_power_act. Legacy bare Earnie_Verbraucher_Leistung still recognised."
    },
    {
      "ehal_field": "flex.sens_consumer_active",
      "loxone_blocks_key": "ehal_bindings.consumer.{id}.sens_consumer_active",
      "suggested_name": "Earnie_Verbraucher_{Slug}_Aktiv",
      "notes": "Digital 0/1 Gerät läuft. Storage/VO: consumer.{id}.sens_consumer_active. OR-trigger with Leistung for Powerstation reserve release."
    },
    {
      "ehal_field": "flex.set_enable",
      "loxone_blocks_key": "ehal_bindings.consumer.{id}.set_enable",
      "suggested_name": "Earnie_Verbraucher_{Slug}_Freigabe",
      "notes": "Enable / Freigabe write. Legacy bare Earnie_Verbraucher_Freigabe still recognised."
    }
  ],
  "reference": "docs/referenz/loxone-signals.md"
}
